{
  "$schema": "http://json-schema.org/draft-07/schema#",
  "$id": "https://ellipog.dev/tasked/_schema/chapter.schema.json",
  "title": "Tasked chapter manifest",
  "description": "One chapter folder's chapter.json, under config/tasked/quests/. The folder it sits in must be named after the chapter's id, and `quests` lists the file names of that chapter's quests, in the order they should appear.",
  "type": "object",
  "required": ["id", "title"],
  "additionalProperties": false,
  "properties": {
    "$schema": {
      "type": "string",
      "description": "Ignored by Tasked. For your editor. Depth-counted: three levels up from a chapter folder is the quest root."
    },
    "id": {
      "$ref": "#/definitions/id",
      "description": "Must equal the name of the folder this file is in. Tasked reports the mismatch naming both sides, and uses the folder name."
    },
    "title": { "$ref": "#/definitions/text" },
    "subtitle": { "$ref": "#/definitions/text" },
    "description": {
      "oneOf": [
        { "$ref": "#/definitions/text" },
        { "type": "array", "items": { "$ref": "#/definitions/text" } }
      ],
      "description": "Paragraphs. A bare string is also accepted, for a one-line description."
    },
    "icon": { "$ref": "#/definitions/itemRef", "description": "Defaults to paper if absent." },
    "aliases": { "type": "array", "items": { "$ref": "#/definitions/id" } },

    "progressionMode": {
      "enum": ["flexible", "linear"],
      "default": "flexible",
      "description": "In a linear chapter the order of the `quests` list *is* the progression: each unlocks when the one above it completes, and no dependsOn is needed. A linear chapter that also declares dependsOn is a warning, not an error - the explicit edges win and the list order is then doing nothing."
    },
    "defaultPrerequisiteMode": {
      "enum": ["all_completed", "one_completed", "all_started", "one_started"],
      "default": "all_completed",
      "description": "What every quest in this chapter uses unless it says otherwise."
    },
    "defaultConsumeItems": {
      "type": "boolean",
      "default": false,
      "description": "Whether item tasks in this chapter take the items unless the task says otherwise. The inherited default, which is why it lives here: an author sets it once for a whole trade chapter."
    },
    "autoClaim": {
      "enum": ["default", "disabled", "enabled", "no_toast", "invisible"],
      "default": "default",
      "description": "Whether this chapter's quests hand their rewards over on completion. `enabled` pays with a notification, `no_toast` silently, `invisible` with no trace at all; `disabled` waits for a claim, and `default` defers to the pack setting in index.json. A quest overrides this, and a reward's own `auto` overrides that. Rewards that need a decision - a choice reward - are never auto-granted whatever this says."
    },
    "dependencyStyle": {
      "$ref": "#/definitions/dependencyStyle",
      "description": "How this chapter's dependency lines are drawn unless a line overrides an axis. This is what a line's \"Use chapter default\" resets to. Only the axes named here are chosen: an axis left out falls back to the built-ins (chamfered, one, solid, thin), and a line that names the same axis overrides just that one."
    },
    "theme": {
      "type": "string",
      "description": "A palette this chapter asks to be drawn in. A client concept: the catalogue of themes lives on the client, so this is a plain string here and is reported by the client that could not resolve it."
    },
    "themePatch": {
      "$ref": "#/definitions/themePatch",
      "description": "Token-level overrides for `theme`: individual colours, a corner radius and a canvas background applied over the named theme (or over the player's own when no theme is named). This is how a chapter sets \"raised #24242E and radius 4\" without shipping a whole theme file, and the Chapter tab's appearance section writes it."
    },

    "quests": {
      "type": "array",
      "items": { "$ref": "#/definitions/name" },
      "description": "The file names of this chapter's quests, in order. Load-bearing rather than cosmetic: a LINEAR chapter's progression *is* this order. A name here that is not on disk is reported; a quest file that is not named here is reported and never loads."
    }
  },

  "definitions": {
    "themePatch": {
      "description": "Token-level overrides for a chapter's theme: individual palette colours, a corner radius and a canvas background, applied over the named theme (or over the player's own when the chapter names none). A client concept, like `theme` itself - the server carries it and the client composes it. The validator checks every token id and value with the toolkit's own reader.",
      "type": "object",
      "additionalProperties": false,
      "properties": {
        "name": {
          "type": "string",
          "description": "A name for the resulting palette. Usually omitted - the Chapter tab writes none, and the name only matters for a file that also wants a display name."
        },
        "colours": {
          "type": "object",
          "description": "Token id to colour, e.g. { \"raised\": \"#FF24242E\" }. A colour is #RRGGBB, #AARRGGBB, or a bare 0xAARRGGBB number. An unknown token id is reported by the validator, and the client ignores it.",
          "additionalProperties": { "type": ["string", "integer"] }
        },
        "canvasBackground": {
          "type": "object",
          "description": "A pattern over the canvas's colour - the same object a theme file carries. `spacing` is content units under `graph` and screen pixels under `screen`; an image is screen-fixed and ignores it. The ink is the `canvasPattern` colour token, whose alpha is a pattern's strength - an image uses only its alpha and draws in white.",
          "additionalProperties": false,
          "properties": {
            "pattern": {
              "enum": ["none", "dot_grid", "grid_lines", "speckle", "hatch", "image"],
              "description": "The pattern to draw."
            },
            "space": {
              "enum": ["graph", "screen"],
              "description": "What the pattern is anchored to: the content, or the screen. Ignored by `image`, which is always screen-fixed."
            },
            "spacing": {
              "type": "integer",
              "minimum": 6,
              "maximum": 256,
              "description": "Distance between repeats. Clamped to this range by the reader."
            },
            "size": {
              "type": "integer",
              "minimum": 1,
              "maximum": 4,
              "description": "The edge of a dot or speck and the thickness of a line or hatch step, in pixels. Clamped to this range by the reader."
            },
            "density": {
              "type": "integer",
              "minimum": 2,
              "maximum": 16,
              "description": "Speckle only: one cell in this many carries a mark. Clamped to this range by the reader."
            },
            "direction": {
              "enum": ["slash", "backslash"],
              "description": "Hatch only: which way the diagonal leans."
            },
            "fit": {
              "enum": ["tile", "cover"],
              "description": "Image only: repeat the texture at `tile` size, or draw it once scaled to cover and centred."
            },
            "texture": {
              "type": "string",
              "description": "Image only: the texture id, canonicalised to `ns:textures/path.png`. An unresolvable texture draws nothing."
            },
            "tile": {
              "type": "integer",
              "minimum": 4,
              "maximum": 256,
              "description": "Image only, under `tile` fit: the width one repeat is drawn at, in pixels. Clamped to this range by the reader."
            }
          }
        },
        "cornerRadius": {
          "type": "integer",
          "minimum": 0,
          "description": "Corner radius in pixels for the chapter's surfaces. Zero is square."
        },
        "motion": {
          "type": "integer",
          "minimum": 0,
          "description": "Transition duration in milliseconds. Zero disables transitions."
        },
        "easing": {
          "enum": ["LINEAR", "QUAD_IN", "QUAD_OUT", "QUAD_IN_OUT", "CUBIC_OUT", "SINE_IN_OUT", "BACK_OUT"],
          "description": "The easing curve transitions use."
        }
      }
    },

    "text": {
      "description": "Either a plain string, or a translation key with an English fallback.",
      "oneOf": [
        { "type": "string" },
        {
          "type": "object",
          "required": ["translate"],
          "additionalProperties": false,
          "properties": {
            "translate": { "type": "string" },
            "fallback": {
              "type": "string",
              "description": "Shown if the translation is missing. Without it a player sees the raw key."
            }
          }
        }
      ]
    },

    "itemRef": {
      "description": "An item, a count, and optional data components. Not an ItemStack - resolved at the moment it is used.",
      "type": "object",
      "required": ["item"],
      "additionalProperties": false,
      "properties": {
        "item": {
          "type": "string",
          "pattern": "^[a-z0-9_.-]+:[a-z0-9_/.-]+$",
          "description": "Namespaced item id, e.g. minecraft:oak_log. An item this build does not have keeps its id and the chapter still loads: the sidebar row draws no icon but says which item is missing on hover, so a removed mod can come back."
        },
        "count": { "type": "integer", "minimum": 1, "maximum": 6400, "default": 1 },
        "components": {
          "type": "object",
          "description": "1.21 data components, keyed by component id in the datapack's own spelling. A text component's value is a string holding JSON, as the codec writes it -- the editor writes that form when you pick a renamed item for the chapter's icon.",
          "additionalProperties": true
        }
      }
    },

    "dependencyStyle": {
      "description": "A chapter's default line style. Only the axes it names are chosen; omitted axes fall back to the built-ins (chamfered, chevron at the target, solid, thin). Anchors and split control points are deliberately not settable here - which rim a line meets is a fact about that line's two ends, so they are per-line settings, declared in the quest schema's `dependencyLines`.",
      "type": "object",
      "additionalProperties": false,
      "properties": {
        "form": {
          "enum": ["orthogonal", "chamfered", "straight", "curved"],
          "description": "The route's shape. Chamfered is the built-in default: the three-segment step with every 90-degree corner cut at 45 degrees, a circuit trace. Orthogonal is the same step left square, straight a direct line, and curved a smooth bow, which reads `bend`."
        },
        "arrowHead": {
          "enum": ["chevron", "triangle", "dot", "diamond", "none"],
          "description": "The glyph an arrowhead is drawn as. Chevron is the built-in; none is a blunt line end."
        },
        "arrowPlace": {
          "enum": ["target", "both", "mid", "stream"],
          "description": "Where the heads sit: one at the dependent end (the built-in), one at each end, one in the middle of the route, or a repeating run."
        },
        "arrowDensity": {
          "enum": ["low", "medium", "high"],
          "description": "How far apart a stream repeats: 64, 32 or 16 pixels. Ignored by the other placements."
        },
        "arrows": {
          "enum": ["none", "one", "both", "many"],
          "description": "Legacy, read but no longer written: the single axis the three arrow axes replaced. None is a blunt end, one a chevron at the target, both one at each end, and many a stream at its old 24-pixel spacing."
        },
        "dash": {
          "enum": ["solid", "dashed", "dotted", "dash_dot", "double", "hazard"],
          "description": "The line's pattern. Double is two hairlines either side of the route and ignores `weight`; hazard is the run plus diagonal hatch marks."
        },
        "weight": {
          "enum": ["thin", "thick", "bold", "conduit"],
          "description": "How many pixels wide: 1, 2, 3, or a 6-pixel conduit with dark borders around a lighter core."
        },
        "bend": {
          "type": "number",
          "minimum": -0.8,
          "maximum": 0.8,
          "description": "How far a curved line bows, as a fraction of the chord between its ends. Positive bows one way and negative the other."
        }
      }
    },

    "id": {
      "type": "string",
      "pattern": "^[a-z0-9_]{1,64}$",
      "description": "Lowercase letters, digits and underscores. This id appears in player progress files, so changing it needs an entry in `aliases`."
    },

    "name": {
      "type": "string",
      "pattern": "^(?!\\.{1,2}$)(?!_)[^/\\\\]{1,128}$",
      "description": "A single path segment: the name of something in the same folder as the file that declares it. No separator, not `.` or `..`, and not beginning with `_` (every `_`-prefixed name is skipped, everywhere, so a reference to one could never resolve). A dot inside the name is fine - this is how a chapter lists `punch_a_tree.json`."
    }
  }
}
