{
  "$schema": "../../_schema/chapter.schema.json",
  "id": "toolsmith",
  "title": "Toolsmith",
  "subtitle": "Branches, a repeatable job, and a hoard",
  "description": [
    "Eleven quests, and most of them are a sentence about the format wearing a",
    "blacksmith's apron. The other chapter of this group, The Shop, is the",
    "quieter lesson: a chapter that sets one default and lets every quest in it",
    "inherit the answer."
  ],
  "theme": "obsidian",
  "icon": { "item": "minecraft:anvil" },
  "quests": [
    "smelt_iron.json",
    "forge_a_hammer.json",
    "specialise_blade.json",
    "specialise_tools.json",
    "tend_the_forge.json",
    "the_apprentice.json",
    "build_all_the_things.json",
    "the_storeroom.json",
    "the_long_road.json",
    "optional_curiosity.json",
    "the_hoard.json"
  ]
}
