{
  "$schema": "../../_schema/chapter.schema.json",
  "id": "the_threshold",
  "title": "The Threshold",
  "subtitle": "the third of fifteen depths",
  "theme": "modern",
  "description": [
    "A door in the hillside, a stair, and the last level ground for a",
    "very long time. The threshold is where the descent stops being a",
    "route on a map and starts being a thing you are inside of.",
    "",
    "Modern is the theme of the threshold: rounded corners, clean",
    "panels, the look of something engineered on purpose."
  ],
  "icon": {
    "item": "minecraft:smooth_stone"
  },
  "progressionMode": "linear",
  "quests": [
    "threshold_arrival.json",
    "threshold_path.json",
    "threshold_ward.json",
    "threshold_hazard.json",
    "threshold_treasure.json",
    "threshold_on.json"
  ]
}
