{
  "$schema": "../../_schema/chapter.schema.json",
  "id": "gallery_terminal",
  "title": "Terminal",
  "subtitle": "Green on black, and nothing in the way",
  "aliases": [
    "terminal",
    "term"
  ],
  "theme": "terminal",
  "description": [
    "Monospace green on black, which is the least Minecraft-looking theme in the set and is",
    "here for packs that want that. Every surface in it does nothing but hold text up.",
    "",
    "It is the second theme with a non-zero but very short motion -- 60ms on a linear curve,",
    "against Modern's 140ms eased. Clicking between this chapter and Modern is the quickest",
    "way to feel the difference between an eased transition and a linear one: the linear one",
    "arrives faster and stops harder.",
    "",
    "Radius 0, like Vanilla Plus, so the panels are square. It is the only theme that is both",
    "square and animated."
  ],
  "icon": {
    "item": "minecraft:command_block"
  },

  "quests": [
    "term_start.json",
    "term_count.json",
    "term_repeat.json",
    "term_gate.json",
    "term_read.json",
    "term_end.json"
  ]
}
