{
  "$schema": "../../_schema/chapter.schema.json",
  "id": "gallery_tome",
  "title": "Tome",
  "subtitle": "Parchment and brass",
  "aliases": [
    "tome"
  ],
  "theme": "tome",
  "description": [
    "A parchment and brass reskin, and the theme that proves a palette is a parameter rather",
    "than a set of constants -- because two of its values differ from Modern's by more than a",
    "tint.",
    "",
    "Its selected ring is brass, not blue. A parchment canvas with a bright blue selection ring",
    "is two palettes arguing, and that is the kind of thing only a second theme finds: a colour",
    "that looked fine on its own turns out to have been chosen against the surfaces around it.",
    "",
    "Its corner radius is 8 against Modern's 4, and it is the chapter where the radius is",
    "easiest to see: open this chapter and then Vanilla Plus, and watch the panel's corners. A",
    "parchment interface with square corners is a different interface, which is why the two",
    "are the pair to compare."
  ],
  "icon": {
    "item": "minecraft:lectern"
  },

  "quests": [
    "script_pens.json",
    "script_bind.json",
    "script_copy.json",
    "script_catalogue.json",
    "script_reading.json",
    "script_vault.json"
  ]
}
