{
  "$schema": "../../_schema/chapter.schema.json",
  "id": "the_glare",
  "title": "The Glare",
  "subtitle": "the fifth of fifteen depths",
  "theme": "high_contrast",
  "description": [
    "A canyon of calcite where the light arrives once and then never",
    "leaves, bouncing wall to wall until the stone gives it back at",
    "full volume.",
    "",
    "High contrast is the theme of the glare: black on white, no",
    "rounded corners, nothing softened."
  ],
  "icon": {
    "item": "minecraft:calcite"
  },
  "progressionMode": "linear",
  "quests": [
    "glare_arrival.json",
    "glare_path.json",
    "glare_ward.json",
    "glare_hazard.json",
    "glare_treasure.json",
    "glare_on.json"
  ]
}
