{
  "$schema": "../../_schema/chapter.schema.json",
  "id": "gallery_end",
  "title": "End",
  "subtitle": "Void purple, darker than anything else here",
  "aliases": [
    "end",
    "the_end"
  ],
  "theme": "end",
  "description": [
    "The darkest surfaces in the gallery -- deeper than Obsidian's, which is the other",
    "near-black theme -- with a violet accent and a pale chorus green for the completed state.",
    "",
    "Radius 8, the same as Tome's. Tome rounds light-on-warm and this rounds dark-on-dark,",
    "which is worth seeing side by side because the same radius on the same panel reads as a",
    "softer edge in one and a harder one in the other.",
    "",
    "Its progress line is a bright violet, and on a canvas this dark a line that bright reads",
    "as a beam rather than a connector. That is the intended reading: the End's version of",
    "progression is something travelling."
  ],
  "icon": {
    "item": "minecraft:end_stone"
  },

  "quests": [
    "end_start.json",
    "end_count.json",
    "end_repeat.json",
    "end_gate.json",
    "end_read.json",
    "end_end.json"
  ]
}
