{
  "$schema": "../../_schema/chapter.schema.json",
  "id": "the_wyrm",
  "title": "The Wyrm",
  "subtitle": "Small nodes, a wide open canvas",
  "description": [
    "Nothing in this chapter lines up, and that is the lesson. A spine bends",
    "twice across the canvas, two short branches hang off it, and a moon sits",
    "above the middle -- all of it placed by hand, none of it on a grid.",
    "",
    "It is also the smallest a node gets. Sixteen pixels is the floor, and an",
    "icon that fills it is what makes a speck read as a star rather than as a",
    "dot; the moon is the other end of both ranges at once.",
    "",
    "The dependencies are ordinary ones -- each star names the last sighting it",
    "needs -- so the figure can be walked in order, or wandered into from either",
    "branch."
  ],
  "theme": "end",
  "icon": { "item": "minecraft:spyglass" },
  "quests": [
    "first_light.json",
    "the_ember.json",
    "the_sickle.json",
    "the_wanderer.json",
    "the_crown.json",
    "the_herald.json",
    "the_keeper.json",
    "the_serpent.json",
    "the_coil.json",
    "the_hook.json",
    "the_wake.json",
    "the_drift.json",
    "the_shoal.json",
    "the_rise.json",
    "the_claw.json",
    "the_eye.json",
    "the_maw.json",
    "the_horn.json",
    "the_wing.json",
    "the_wingtip.json",
    "the_fang.json",
    "the_fangtip.json",
    "the_moon.json",
    "the_wyrm_awakens.json"
  ]
}
