{
  "$schema": "../../_schema/chapter.schema.json",
  "id": "gallery_obsidian",
  "title": "Obsidian",
  "subtitle": "Near-black purple, lit from inside",
  "aliases": [
    "obsidian"
  ],
  "theme": "obsidian",
  "description": [
    "Obsidian and crying obsidian: the darkest surfaces in the gallery, with a violet glow",
    "doing all the work. Every colour here that is not near-black is a purple.",
    "",
    "The interesting value is the connector line. On a canvas this dark a line has to be",
    "brighter than the surface it crosses and dimmer than the nodes at either end, or the",
    "graph reads as unconnected boxes -- and there is very little room between those two",
    "constraints when the surface is at 11,9,20.",
    "",
    "Radius is 2, so this is one of the two squarest themes. Compare the quest overlay's",
    "panel against Tome's while you are here: the same panel, drawn through the same code,",
    "and the corners are the only difference."
  ],
  "icon": {
    "item": "minecraft:obsidian"
  },

  "quests": [
    "obs_start.json",
    "obs_count.json",
    "obs_repeat.json",
    "obs_gate.json",
    "obs_read.json",
    "obs_end.json"
  ]
}
