{
  "$schema": "../../_schema/chapter.schema.json",
  "id": "the_far_shore",
  "title": "The Far Shore",
  "subtitle": "the fourteenth of fifteen depths",
  "theme": "end",
  "description": [
    "Through the archive's door: an island country under no sky in",
    "particular, pale, silent, and watching. The descent's last",
    "stratum that has a floor.",
    "",
    "End is the theme, and the void supplies the contrast."
  ],
  "icon": {
    "item": "minecraft:end_stone"
  },
  "progressionMode": "linear",
  "quests": [
    "far_shore_arrival.json",
    "far_shore_path.json",
    "far_shore_ward.json",
    "far_shore_hazard.json",
    "far_shore_treasure.json",
    "far_shore_on.json"
  ]
}
